Company Name,Company Website
ERAYAHA VENTURES LLP,erayaha.ai
DEALDOX SOFTWARE PRIVATE LIMITED,https://www.dealdox.io/
ZIPPYFIN SOLUTIONS LLP,https://www.zippyfin.io
SOLWYZ TECHNOLOGIES PRIVATE LIMITED,www.solwyz.com
HUDDLZ CHAT TECHNOLOGIES PRIVATE LIMITED,https://huddlz-chat.notion.site/Huddlz-Chat-10a4e52b9f74808c8792e047c9b3e275
PET360 SOLUTIONS PRIVATE LIMITED,https://pet360assist.com
INTHES BIOTECH (OPC) PRIVATE LIMITED,NA
BHAVANTU SOFTWARE LLP,https://bhavantusoftware.com/
CRELT PRIVATE LIMITED,https://www.crelt.com/
BLUE DECIMAL TECHNOLOGIES PRIVATE LIMITED,https://bluedecimal.com/
NIMBUSONE TECHNOLOGIES PRIVATE LIMITED,www.nimbusone.co.in
GESTUREMINDS SOFTWARE PRIVATE LIMITED,https://www.clientkyc.com/
GUIDENCO SOFTWARE PRIVATE LIMITED,https://onvo.ai/
DATABUS TECHNOLOGY SOLUTIONS PRIVATE LIMITED,https://www.databus.co
WEBFREEZE SOLUTION PRIVATE LIMITED,http://travbizz.com/
SHARP MINDS CLOUD TECH PRIVATE LIMITED,www.sharpmindscloudtech.com
CSTACK TECHNOLOGIES PRIVATE LIMITED,trypeach.io
SENYA SOLUTIONS PRIVATE LIMITED,https://www.franchisee.ai/
KODEWIN SOLUTIONS PRIVATE LIMITED,www.Kodewin.com
LABELBLIND SOLUTIONS PRIVATE LIMITED,https://foodlabelsolutions.com
VISTRIVE TECHNOLOGIES PRIVATE LIMITED,https://www.vistrivetech.com
ONEJAM CLOUDTECH PRIVATE LIMITED,https://onejam.io/
CONTRACTOR PLUS LLP,https://contractorplus.app/
MARKETRICS TECHNOLOGIES PRIVATE LIMITED,https://easyreplenish.com/
Telosa Services Pvt Ltd,www.telosa.review
Gway Tech Solutions Private Limited,https://gwayerp.com/
TRADEREBOOT TECH PRIVATE LIMITED,https://tradetech.tradereboot.com/home
GOLDENPEGASUS IT CONSULTING AND SERVICES PRIVATE LIMITED,https://www.thecompanycheck.com/people/goldenpegasus-it-consulting-and-services/U72900PN2023PTC217495
GLISTENINFO TECH INDIA LLP,https://glisteninfotech.com/
T3WORKFORCE PRIVATE LIMITED,www.t3workforce.com
ELEVENTS METAESTATE PRIVATE LIMITED,ELEVENTS METAESTATE PRIVATE LIMITED
IOO LABS PRIVATE LIMITED,https://ioolabs.com/
PERKI SOLUTIONS PRIVATE LIMITED,https://viasuccess.io/
FORGE AI PRIVATE LIMITED,https://www.empirical.run
YJK TECHNOLOGIES PRIVATE LIMITED,https://www.yjktechnologies.com/
ARRESTO SOLUTIONS PRIVATE LIMITED,https://arresto.in
REVRR TECHNOLOGIES PRIVATE LIMITED,https://revrr.ai/
RADIANCE LABS,https://glamcam.ai/
QUODEWORKS CONSULTING LLP,https://quodeworks.com
RATIOSPHERE TECHNOLOGIES PRIVATE LIMITED,www.ratiosphere.com
VWAVES TECHNOLOGIES PRIVATE LIMITED,https://visionwaves.com/
ShopIQ,https://shopiq.app/
EDUWITY SOLUTION PRIVATE LIMITED,eduwity.com
SAIS016 TECHNOLOGY SOLUTIONS PRIVATE LIMITED,https://www.datarenew.net/
BIG BEAR TECHNOLOGIES PRIVATE LIMITED,https://www.bigbeartech.in/
ARMPILOT TECHNOLOGIES PRIVATE LIMITED,https://armpilot.com/#/
PORTSTAY TECHNOLOGIES PRIVATE LIMITED,https://portstay.com
FLOYDEE INNOVATIONS PRIVATE LIMITED,NA
MSD BUSINESS SOLUTIONS PRIVATE LIMITED,MSD BUSINESS SOLUTIONS PRIVATE LIMITED
ROYALSOFT SERVICES PRIVATE LIMITED,https://www.falconebiz.com/company/ROYALSOFT-SERVICES-PRIVATE-LIMITED-U58200GJ2024PTC155372
IDAMUMAI TECHNOLOGIES PRIVATE LIMITED,https://www.responsus.in/
REALLISTAI TECHNOLOGIES PRIVATE LIMITED,REALLISTAI TECHNOLOGIES PRIVATE LIMITED
SINGARA CHETTIAR (OPC) PRIVATE LIMITED,https://kfinsolutions.com/
DEFENDSHIELD TECHNOLOGIES PRIVATE LIMITED,https://ampirial-labs.framer.website/
FLOURISHERS EDGE PRIVATE LIMITED,https://www.flourishersedge.com/
COMPLYX TECH SOLUTION PRIVATE LIMITED,https://www.linkedin.com/company/complyxtech
INTIANT TECH PRIVATE LIMITED,https://www.intiant.com/
CLOUDFEN SOFTWARE SOLUTIONS PRIVATE LIMITED,https://cloudfen.com/index.html
CAROL SOLUTIONS,www.carolsolutions.com
CODE 9 SOFTWARE TECHNOLOGIES & CONSULTANCY PRIVATE LIMITED,https://code9.cloud/
OTFCODER PRIVATE LIMITED,https://www.otfcoder.com
BOOKSPOT TECHNOLOGIES PRIVATE LIMITED,bookspot.app
IOWARE DIGITAL SOLUTIONS LLP,https://ioxpert.com/
Macha Community,www.macha.ai
HOSTBET CLOUD TECHNOLOGIES PRIVATE LIMITED,https://www.hostbet.in/
learnyn technology park llp,https://www.learnyn.io
PRASHAAR INNOVATIONS PRIVATE LIMITED,https://prashaar.com/
SOFTNOVA LABS PRIVATE LIMITED,In development phase
TIFANTS INGRESS LLP,www.tifantsingress.com
CHAOS NUMERICS PRIVATE LIMITED,www.chaosnumerics.com
SERENSYNTH LABS PRIVATE LIMITED,https://www.goldlabsexpress.co.in/
HYPERTEST INDIA PRIVATE LIMITED,https://www.hypertest.co/
Noblegiving Private Limited,https://www.noblegiving.in/
SALEAZY TECHNOLOGIES PRIVATE LIMITED,www.affluense.in
Sovrin,https://sovrin.one
HEXAGREEN CONSULTANCY PRIVATE LIMITED,https://www.pmpeople.ai/
SPAREROWS TECHNOLOGY PRIVATE LIMITED,https://sparerows.com/
KIWIMESH TECHNOLOGIES PRIVATE LIMITED,https://kiwimesh.com
MASTERBITZ TECHNOLOGIES SOFTWARE SOLUTIONS PRIVATE LIMITED,https://www.masterbitztechnologies.com
QBEX PHARMA,https://www.qbexpharma.com/
PPLIO TECHNOLOGIES PRIVATE LIMITED,http://www.pplio.com
ALMIGHTY CONSULTING SOLUTIONS PRIVATE LIMITED,https://www.almightycs.com/
TECHRONYX SOLUTIONS PRIVATE LIMITED,https://techronyx.com/
OPENSAAS SOLUTIONS PRIVATE LIMITED,www.cubiclespace.pro
TrustAdditive,https://trustadditive.com/
MOBILITYSQR SERVICES PRIVATE LIMITED,MOBILITYSQR SERVICES PRIVATE LIMITED
GEOMETRY SYSTEMS PRIVATE LIMITED,https://www.prism.net.in/
VERAHAAN HOSPITALITY TECH SOLUTIONS LLP,VERAHAAN HOSPITALITY TECH SOLUTIONS LLP
KARYAMSHA LABS PRIVATE LIMITED,https://karyah.app/
HOSIGENIE HOSPITALITY SERVICES PRIVATE LIMITED,www.mygenie.online
QUASITECH INNOVATIONS PRIVATE LIMITED,https://www.glyphhq.com
DATONIX SOFTWARE PRIVATE LIMITED,https://datonix.in/
YANTRA AI SOLUTIONS,https://www.yantraai.in/
INVINITY INDIA PRIVATE LIMITED,https://www.invinityindia.com/
SASTORM SOFTWARE INFOTECH PRIVATE LIMITED,https://sastormsoftware.com/
KITESUITE SOFTECH PRIVATE LIMITED,https://kitesuite.com
HALL5 TECHNOLOGIES PRIVATE LIMITED,https://hoomanlabs.com/
AllThingsDev I atd,https://allthingsdev.co
EMEELAN SOLUTIONS PRIVATE LIMITED,https://www.emeelan.com/
DEIENAMI PRIVATE LIMITED,https://deienami.com
SYSGENPRO SOFTWRAE PRIVATE LIMITED,WWW.SYSGENPRO.COM
