Company Name,Website,Email IDs,Contact Numbers
ALPHAHERD VETERINARY SOFTWARE PRIVATE LIMITED,https://in.linkedin.com/company/alphaherd,hello@alphaherd.net,
IPUVI SOLUTION PRIVATE LIMITED,http://www.ipuvi.com,"techpartner@ipuvi.com, info@ipuvi.com, hr@ipuvi.com, sales@ipuvi.com",+91944243636
DROPHIVE COMMERCE PRIVATE LIMITED,http://DROPHIVE COMMERCE PRIVATE LIMITED,,
CHILL CITY TECHNOLOGY PRIVATE LIMITED,https://www.raidotaxi.com/,,
CREATIK MULTI SERVICES PRIVATE LIMITED,http://creatikmultiservices.com,creatikpvtltd44@gmail.comWebsite,
AHMAD ASSOCIATES PRIVATE LIMITED,http://WWW.AHMADASSOCIATES.IN,,
I2INTERFACES LLP,https://i2interfaces.com/,,
SMALBLU TECHNOLOGIES PRIVATE LIMITED,https://www.equipsetu.com/,support@equipsetu.com,+91 6354057091
ARTBYR TECH LLP,https://tailorswyft.com/,info@tailorswyft.com,
CHORD INNOVATION TECHNOLOGIES PRIVATE LIMITED,https://www.chhord.com/,,
TRISHULA TECHNOLOGIES PRIVATE LIMITED,https://www.mca.gov.in/content/mca/global/en/mca/master-data/MDS/company-master-info.html,,
WRITOMAT SOLUTIONS PRIVATE LIMITED,https://writomat.ai/,wecare@writomat.ai,
SEC AND DEVOPS AI PRIVATE LIMITED,https://devseccops.ai,"swati@devseccops.ai, nishant@devseccops.ai",
BR DATA SOLUTIONS,https://www.brdata.in/#about,"apps@brdata.in?subject=Mail+from+BR+Ticket+Admin+site, apps@brdata.in",+91-4171-221234
CONNECTSTREAM (OPC) PRIVATE LIMITED,http://www.connectstream.io/,,
ERAYAHA VENTURES LLP,http://erayaha.ai,,
RUPK CONNECT PRIVATE LIMITED,http://N/A,,
REVIEWNB DATA LABS LLP,https://www.reviewnb.com/,"support@reviewnb.comTerms, team@reviewnb.com, support@reviewnb.com",
REPORDIME SYSTEMS INDIA PRIVATE LIMITED,http://repordime.com,"hello@repordime.com, addressSubmithello@repordime.comSocialsSubscribe",+919108779393
TIGER MOBILITY SOLUTIONS PRIVATE LIMITED,http://www.tigercabs.com,support@tigercabs.com,8100035098
EZEE DIGITAL SOLUTION PRIVATE LIMITED,http://www.ezeeprodigy.com,ezeeprodigy@gmail.com,
TECHXEDO NETWORKS PRIVATE LIMITED,https://techxedo.in/,support@techxedo.in,
BIGAPPLE SYSTEMS PRIVATE LIMITED,https://drerp.ai/,"customercare@drerp.ai, %20customercare@drerp.ai",%20+91%20939%206262%20939
DEVSTAK TECHNOLOGIES PRIVATE LIMITED,https://scoutflo.com/,"contactus@scoutflo.com, contactus@scoutflo.comPrivacy",
ZINO TECHNOLOGIES PRIVATE LIMITED,https://www.getzino.com/,,
AutoGrowth Private Limited,https://autogrowth.net,hello@autogrowth.net,+91-9821 365 870
MyShowroom,http://www.mysr.io,,
OCDEN CYBERSECURITY SYSTEMS PRIVATE LIMITED,https://www.ocden.com,sachin@ocden.com,
N3CLOUDS TECHNOLOGIES PRIVATE LIMITED,https://www.unifylist.com/,,
IDCSPROTECH SOLUTIONS PRIVATE LIMITED,http://www.dcspro.in,info@dcspro.in,+91 8920674944
DEEPWORK TECHNOLOGIES PRIVATE LIMITED,https://floww.ai/,"ushello@floww.ai, hello@floww.ai",+918008900902
SURVHANA TECHNOLOGIES PRIVATE LIMITED,http://NA,,
SUTRAM SOLUTIONS PRIVATE LIMITED,https://sutramsolutions.com/,,
KAMENG TECHNOLOGIES PRIVATE LIMITED,http://www.leadstacts.com,wecare@leadstacts.com,+91-9008170212
ILOGICPLUS SOLUTIONS LLP,http://www.ilogicplus.com,info@ilogicplus.com,"+916238870610, ‎+916238870610"
XPECTRO SOLUTIONS (OPC) PRIVATE LIMITED,https://xpectro-solutions.com/,,
FEMLOGIC TECHNOLOGIES INDIA PRIVATE LIMITED,http://www.femlogic.in,info@femlogic.in,+9191761%2031866
LN INFOSPHERE TECHTRANSFORMERS PRIVATE LIMITED,https://complai.onrender.com,,
PROQX B2B PROCUREMENT PRIVATE LIMITED,https://www.proqx.com/,9586828676contact@proqx.comSubscribe,
REINTELL SOFTTECH PRIVATE LIMITED,https://www.supereps.ai/,,
FXMEDIALAB,http://www.fxmedialab.com,"info@fxmedialab.com, info@fxmedialab.comm",
REMEDIUS SOFTWORKS PRIVATE LIMITED,https://ficura.in/,"contact@ficura.healthGet, contactus@ficura.health?subject=Inquiry%3A%20%5BBrief%20mention%20of%20your%20reason%20for%20contacting%5D, contact@ficura.health?subject=Inquiry%3A%20%5BBrief%20mention%20of%20your%20reason%20for%20contacting%5D",
VIRRAN TECH SOLUTIONS PRIVATE LIMITED,https://www.virrantech.com/,sales@virrantech.com,
ASTRAOPS PRIVATE LIMITED,http://www.astraops.com/,,
SWIPPY TECH LLP,http://www.swippy.in,"mail@swippy.in, Pradeshmail@swippy.in",+917018803644
PLAYSUPER SOFTWARE SOLUTIONS PRIVATE LIMITED,https://playsuper.club/,"team@playsuper.clubTerms, team@playsuper.club",
NEURALSOFT PRIVATE LIMITED,http://nspltech.com,"careers@a21.ai, #, contactus@a21.ai",
CRELT PRIVATE LIMITED,https://www.crelt.com/,"sales@crelt.com, help@crelt.com",
BLUE DECIMAL TECHNOLOGIES PRIVATE LIMITED,https://bluedecimal.com/,,
NIMBUSONE TECHNOLOGIES PRIVATE LIMITED,http://www.nimbusone.co.in,,
GESTUREMINDS SOFTWARE PRIVATE LIMITED,https://www.clientkyc.com/,,
